{
  "schema_version": "1",
  "run_id": "20260611T151747Z-chunk-c2-steam-boundary",
  "date": "2026-06-11",
  "phase": "phase4-steam-boundary",
  "host": "CachyOS/Wayland/KDE/NVIDIA",
  "jsm_commit": null,
  "steam_client": "1781139754",
  "lanes": ["steam"],
  "slices": [
    {
      "slice": "digital",
      "verdict": "exact",
      "jsm_capture": null,
      "steam_capture": "digital.xi2.jsonl",
      "injector_log": "holder.log",
      "key_roles": {
        "steam": {"digital": "F9"}
      },
      "notes": "Canary slice. South->F9. 3 presses -> 3 exact F9 pairs at XI2. Run before each batch sub-session. All canary passes confirmed (3/3)."
    },
    {
      "slice": "taphold_boundary",
      "verdict": "bounded_approximation",
      "jsm_capture": null,
      "steam_capture": "taphold_boundary.xi2.jsonl",
      "injector_log": "holder.log",
      "key_roles": {
        "steam": {"tap": "F10", "hold": "F11"}
      },
      "binding_params": {
        "long_press_time_ms": 450,
        "interruptable": true
      },
      "notes": "East: F10 full-press / F11 long-press @450ms default. Presses at 430/450/470ms. Steam hold fires INCLUSIVE at 450ms (>= threshold). Cross-runtime delta: JSM hold boundary is exclusive + poll-interval offset (~1 poll above HOLD_PRESS_TIME). Converter must account for inclusive vs exclusive boundary semantics."
    },
    {
      "slice": "doublepress_boundary",
      "verdict": "bounded_approximation",
      "jsm_capture": null,
      "steam_capture": "doublepress_boundary.xi2.jsonl",
      "injector_log": "holder.log",
      "key_roles": {
        "steam": {"base": "F12", "double": "F7"}
      },
      "binding_params": {
        "double_tap_time_ms": 190
      },
      "notes": "North: F12 single / F7 double @190ms default. Gaps 170/190/210ms (down-to-down). Steam window EXCLUSIVE at 190ms measured down-to-down: 170ms fires double, 190ms fires two singles. Cross-runtime epoch mismatch: JSM measures release-to-down (confirmed C1 commit 4c8fab5)."
    },
    {
      "slice": "trigramp",
      "verdict": null,
      "jsm_capture": null,
      "steam_capture": "trigramp.xi2.jsonl",
      "injector_log": "holder.log",
      "key_roles": {
        "steam": {"soft": "F3", "full": "F4"}
      },
      "binding_params": {
        "adaptive_threshold": 3
      },
      "notes": "ANOMALY — adjudicated by 20260611T153109Z: F3 did not fire because RZ=100 is below the adaptive_threshold=3 soft threshold (which lies between RZ=100 and RZ=200). Not a state anomaly. Phase-2 staged result used a higher effective soft-pull value. See adjudication run for resolution."
    },
    {
      "slice": "taphold_interruptable_off",
      "verdict": "exact",
      "jsm_capture": null,
      "steam_capture": "taphold_interruptable_off.xi2.jsonl",
      "injector_log": "holder.log",
      "key_roles": {
        "steam": {"tap": "F10", "hold": "F11"}
      },
      "binding_params": {
        "long_press_time_ms": 450,
        "interruptable": false
      },
      "notes": "interruptable=0 on Full_Press activator. Short press (120ms): F10 only. Long press (600ms): F10 fires on press-down AND F11 fires at 450ms threshold — both active simultaneously. Confirms Steamworks doc: interruptable=0 allows Regular to fire alongside Long. Converter must read this flag per-activator, never assume default."
    }
  ],
  "notes": "Chunk C2 Steam-lane boundary + interruptable traces. VDF started from reference/desktop-layout-phase2-reference.vdf; restored after batch 4. Key findings: Steam taphold boundary inclusive (>=); Steam doublepress window exclusive (<) measured down-to-down; trigramp anomaly adjudicated (adaptive_threshold); interruptable=0 is load-bearing. Key aliasing: Steam emits F11 as L1, F12 as L2 in xinput — folded by normalize_capture.py."
}
