{
  "schema_version": "1",
  "run_id": "20260602T145517Z-phase2-jsm-quickwins",
  "date": "2026-06-02",
  "phase": "phase2-jsm",
  "host": "CachyOS/Wayland/KDE/NVIDIA",
  "jsm_commit": "68dcb97",
  "steam_client": null,
  "lanes": ["jsm"],
  "slices": [
    {
      "slice": "taphold",
      "verdict": "exact",
      "jsm_capture": "taphold.capture.jsonl",
      "steam_capture": null,
      "injector_log": "taphold.injector.log",
      "notes": "E=A B. Short 80ms press->tap KEY_A; long 450ms press->hold KEY_B at 150ms HOLD_PRESS_TIME."
    },
    {
      "slice": "trigfull",
      "verdict": "exact",
      "jsm_capture": "trigfull.capture.jsonl",
      "steam_capture": null,
      "injector_log": "trigfull.injector.log",
      "notes": "ZR_MODE=NO_SKIP. Soft->BTN_RIGHT; full->adds KEY_LEFTSHIFT (NO_SKIP). Spurious BTN_RIGHT at pad disconnect flagged by normalizer as still-held-at-end."
    },
    {
      "slice": "stickwasd",
      "verdict": "exact",
      "jsm_capture": "stickwasd.capture.jsonl",
      "steam_capture": null,
      "injector_log": "stickwasd.injector.log",
      "notes": "LEFT_STICK_MODE=NO_MOUSE, LUP/LDOWN/LLEFT/LRIGHT=W/S/A/D."
    },
    {
      "slice": "simpress",
      "verdict": "degraded_approximation",
      "jsm_capture": "simpress.capture.jsonl",
      "steam_capture": null,
      "injector_log": "simpress.injector.log",
      "notes": "L=LSHIFT,R=E,L+R=Q. L+R->Q correct; lone L after chord->Q (sticky state bug)."
    },
    {
      "slice": "simpress2",
      "verdict": "degraded_approximation",
      "jsm_capture": "simpress2.capture.jsonl",
      "steam_capture": null,
      "injector_log": "simpress2.injector.log",
      "notes": "Lone press first (correct), then chord, then lone again (wrong). Disambiguates that sticky state is residual, not a mapping error."
    },
    {
      "slice": "chord",
      "verdict": "exact",
      "jsm_capture": "chord.capture.jsonl",
      "steam_capture": null,
      "injector_log": "chord.injector.log",
      "notes": "L=NONE,W=B,L,W=G. W alone->KEY_B; L+W->KEY_G."
    },
    {
      "slice": "doublepress",
      "verdict": "exact",
      "jsm_capture": "doublepress.capture.jsonl",
      "steam_capture": null,
      "injector_log": "doublepress.injector.log",
      "notes": "N=B,N,N=X. Single->KEY_B; double->KEY_B then KEY_X."
    },
    {
      "slice": "holdtimeglobal",
      "verdict": "bounded_approximation",
      "jsm_capture": "holdtimeglobal.capture.jsonl",
      "steam_capture": null,
      "injector_log": "holdtimeglobal.injector.log",
      "notes": "HOLD_PRESS_TIME=300 governs E and S simultaneously. Confirms audit gotcha X.2: per-binding hold time unsupported in JSM."
    }
  ],
  "notes": "Phase 2 JSM-lane quick-wins. 6/7 exact; simpress degraded (sticky state). Steam lane blocked at capture time. Orchestrated by run-slice.sh."
}
